{
  "evidence_id": "BAGO-EVD-054",
  "type": "closure",
  "related_to": [
    "BAGO-CHG-053",
    "SES-W7-2026-04-18-005"
  ],
  "summary": "SES-5 E001 cerrada: 3 útiles, 2 roles, GO preflight, 3 decisiones.",
  "details": "BAGO_EVOLUCION_SISTEMA_v2.md: informe completo del pack con 24 sesiones, 102 útiles, 67 decisiones, ecosistema 14 herramientas + 9 workflows. EVAL-ESCENARIO001-FINAL: targets alcanzados (4.2 útiles, 2.0 roles). ESCENARIO-001 cerrado.",
  "status": "recorded",
  "recorded_at": "2026-04-18T14:04:00Z"
}